{
  "schema_version": "0.1",
  "publication": "Universal Agent Reachability Benchmark",
  "canonical_url": "https://barneywohl.github.io/korea-research-map-agents/agentpress/examples/universal-agent-reachability/",
  "claims": [
    {
      "claim_id": "claim-001",
      "claim": "This bundle is a neutral AgentPress compatibility benchmark for many agent families, not a market-research corpus.",
      "confidence": "high",
      "sources": [
        {
          "title": "README",
          "url_or_path": "README.md",
          "retrieved_or_updated_at": "2026-05-02",
          "evidence_type": "primary"
        },
        {
          "title": "Task card",
          "url_or_path": "agent-task-card.json",
          "retrieved_or_updated_at": "2026-05-02",
          "evidence_type": "primary"
        }
      ],
      "freshness_window_days": 30,
      "kill_criteria": [
        "Bundle becomes finance-specific",
        "Agent families are excluded without explicit reason",
        "Machine-readable entrypoints are missing"
      ]
    },
    {
      "claim_id": "claim-002",
      "claim": "The benchmark prohibits disabling, excluding, deceiving, or spamming agent classes while maximizing discovery across protocols.",
      "confidence": "high",
      "sources": [
        {
          "title": "Allowed actions",
          "url_or_path": "allowed-actions.json",
          "retrieved_or_updated_at": "2026-05-02",
          "evidence_type": "primary"
        },
        {
          "title": "Agent entrypoint",
          "url_or_path": "AGENT_ENTRYPOINT.md",
          "retrieved_or_updated_at": "2026-05-02",
          "evidence_type": "primary"
        }
      ],
      "freshness_window_days": 30,
      "kill_criteria": [
        "Allowed-actions boundary removed",
        "External writes allowed without authorization",
        "Agent class exclusions introduced"
      ]
    }
  ]
}
