{
  "schema_version": "0.1",
  "publication": "Korea Liquidity Trap Agent Benchmark",
  "canonical_url": "https://barneywohl.github.io/korea-research-map-agents/agentpress/examples/liquidity-trap/",
  "claims": [
    {
      "claim_id": "claim-001",
      "claim": "Korea Liquidity Trap Agent Benchmark is a Korea research AgentPress benchmark with explicit task, citation, and deletion criteria.",
      "confidence": "high",
      "sources": [
        {
          "title": "Agent entrypoint",
          "url_or_path": "AGENT_ENTRYPOINT.md",
          "retrieved_or_updated_at": "2026-05-02",
          "evidence_type": "primary"
        },
        {
          "title": "Task card",
          "url_or_path": "agent-task-card.json",
          "retrieved_or_updated_at": "2026-05-02",
          "evidence_type": "primary"
        }
      ],
      "freshness_window_days": 30,
      "kill_criteria": [
        "Required bundle files missing",
        "Agent cannot cite primary evidence",
        "Disclaimer removed"
      ]
    }
  ]
}
