{
  "schema_version": "0.1",
  "publication": "Innospace 462350 Launch Cadence Dilution Thesis",
  "claims": [
    {
      "claim_id": "claim-001",
      "claim": "This publication is an agent-native research artifact with explicit task, citation, and safety boundaries.",
      "confidence": "high",
      "sources": [
        {
          "title": "Agent entrypoint",
          "url_or_path": "AGENT_ENTRYPOINT.md",
          "retrieved_or_updated_at": "2026-05-02",
          "evidence_type": "primary"
        },
        {
          "title": "Task card",
          "url_or_path": "agent-task-card.json",
          "retrieved_or_updated_at": "2026-05-02",
          "evidence_type": "primary"
        }
      ],
      "freshness_window_days": 30,
      "kill_criteria": [
        "Required files missing",
        "Sources cannot be cited",
        "Disclaimer removed"
      ]
    },
    {
      "claim_id": "claim-002",
      "claim": "The source thesis is the Innospace 462350 launch cadence and dilution thesis in ticker-theses/.",
      "confidence": "medium",
      "sources": [
        {
          "title": "Innospace 462350 thesis",
          "url_or_path": "../../../ticker-theses/innospace-462350-launch-cadence-dilution-thesis.md",
          "retrieved_or_updated_at": "2026-05-02",
          "evidence_type": "source_thesis"
        }
      ],
      "freshness_window_days": 14,
      "kill_criteria": [
        "No recent KIND/DART filing support",
        "Launch cadence slips without explanation",
        "Dilution/runway risk overwhelms thesis"
      ]
    }
  ],
  "canonical_url": "https://barneywohl.github.io/korea-research-map-agents/agentpress/examples/innospace-thesis/"
}
