{
  "schema_version": "0.1",
  "publication": "KB-FINRATE Korean Bank NIM Compression Thesis",
  "canonical_url": "https://barneywohl.github.io/korea-research-map-agents/agentpress/examples/kb-finrate/",
  "claims": [
    {
      "claim_id": "kb-finrate-claim-001",
      "claim": "Korean bank NIM compression thesis depends on BOK easing and relative deposit/loan repricing speeds.",
      "confidence": "medium",
      "sources": [
        {
          "title": "Bank of Korea monetary policy decisions",
          "url_or_path": "https://www.bok.or.kr/eng/main/main.do",
          "retrieved_or_updated_at": "2026-05-02",
          "evidence_type": "primary_regulator"
        },
        {
          "title": "FSS Financial Statistics Information System",
          "url_or_path": "https://fisis.fss.or.kr/",
          "retrieved_or_updated_at": "2026-05-02",
          "evidence_type": "regulator_statistics"
        }
      ],
      "freshness_window_days": 14,
      "kill_criteria": [
        "BOK does not cut within thesis horizon",
        "FSS/company data show no deposit repricing pressure"
      ]
    },
    {
      "claim_id": "kb-finrate-claim-002",
      "claim": "Agent should compare KB, Shinhan, and Hana disclosures before accepting the thesis.",
      "confidence": "high",
      "sources": [
        {
          "title": "KB Financial Group IR",
          "url_or_path": "https://www.kbfg.com/Eng/ir/financial/index.jsp",
          "retrieved_or_updated_at": "2026-05-02",
          "evidence_type": "company_disclosure"
        },
        {
          "title": "Shinhan Financial Group IR",
          "url_or_path": "https://www.shinhangroup.com/en/ir/finance/finance.jsp",
          "retrieved_or_updated_at": "2026-05-02",
          "evidence_type": "company_disclosure"
        },
        {
          "title": "Hana Financial Group IR",
          "url_or_path": "https://www.hanafn.com/eng/ir/finance/financialStatements.do",
          "retrieved_or_updated_at": "2026-05-02",
          "evidence_type": "company_disclosure"
        }
      ],
      "freshness_window_days": 30,
      "kill_criteria": [
        "Company filings are unavailable or contradict NIM compression"
      ]
    }
  ]
}
